{
  "schemaVersion": 1,
  "revision": 2,
  "updatedAt": "2026-09-10T11:53:44.531Z",
  "phases": [
    {
      "id": "PHASE-000",
      "slug": "discovery",
      "name": "Discovery",
      "description": "Understand the problem, users and anti-scope.",
      "status": "NEEDS_REVIEW",
      "order": 0,
      "owner": null,
      "startDate": null,
      "targetDate": null,
      "completedAt": null,
      "objectives": [
        {
          "id": "OBJ-discovery-01",
          "title": "Problem and anti-scope written",
          "required": true,
          "status": "UNKNOWN"
        },
        {
          "id": "OBJ-discovery-02",
          "title": "Personas named",
          "required": true,
          "status": "UNKNOWN"
        },
        {
          "id": "OBJ-discovery-03",
          "title": "Success looks like X, measured how",
          "required": true,
          "status": "UNKNOWN"
        }
      ],
      "entryCriteria": [
        "Project identity exists"
      ],
      "exitCriteria": [
        "Required objectives complete or UNKNOWN-and-accepted",
        "Required checkpoints PASSED or WAIVED"
      ],
      "featureIds": [],
      "requirementIds": [],
      "taskIds": [],
      "riskIds": [],
      "evidence": [],
      "dependencies": [],
      "releaseId": null
    },
    {
      "id": "PHASE-001",
      "slug": "foundation",
      "name": "Foundation",
      "description": "Identity, architecture, repo wiring, first vertical slice.",
      "status": "NEEDS_REVIEW",
      "order": 1,
      "owner": null,
      "startDate": null,
      "targetDate": null,
      "completedAt": null,
      "objectives": [
        {
          "id": "OBJ-foundation-01",
          "title": "Repo and lifecycle adopted",
          "required": true,
          "status": "UNKNOWN"
        },
        {
          "id": "OBJ-foundation-02",
          "title": "Architecture chosen",
          "required": true,
          "status": "UNKNOWN"
        },
        {
          "id": "OBJ-foundation-03",
          "title": "First vertical slice runs",
          "required": true,
          "status": "UNKNOWN"
        }
      ],
      "entryCriteria": [
        "Discovery completed or waived"
      ],
      "exitCriteria": [
        "Required objectives complete or UNKNOWN-and-accepted",
        "Required checkpoints PASSED or WAIVED"
      ],
      "featureIds": [],
      "requirementIds": [],
      "taskIds": [],
      "riskIds": [],
      "evidence": [],
      "dependencies": [
        "PHASE-000"
      ],
      "releaseId": null
    },
    {
      "id": "PHASE-002",
      "slug": "core",
      "name": "Core Functionality",
      "description": "The capabilities the product is for.",
      "status": "NEEDS_REVIEW",
      "order": 2,
      "owner": null,
      "startDate": null,
      "targetDate": null,
      "completedAt": null,
      "objectives": [
        {
          "id": "OBJ-core-01",
          "title": "Primary user journey works",
          "required": true,
          "status": "UNKNOWN"
        },
        {
          "id": "OBJ-core-02",
          "title": "Domain rules enforced",
          "required": true,
          "status": "UNKNOWN"
        },
        {
          "id": "OBJ-core-03",
          "title": "Acceptance criteria exist",
          "required": true,
          "status": "UNKNOWN"
        }
      ],
      "entryCriteria": [
        "Foundation completed or waived"
      ],
      "exitCriteria": [
        "Required objectives complete or UNKNOWN-and-accepted",
        "Required checkpoints PASSED or WAIVED"
      ],
      "featureIds": [],
      "requirementIds": [],
      "taskIds": [],
      "riskIds": [],
      "evidence": [],
      "dependencies": [
        "PHASE-001"
      ],
      "releaseId": null
    },
    {
      "id": "PHASE-003",
      "slug": "integration",
      "name": "Integration",
      "description": "APIs, data, external systems, end-to-end paths.",
      "status": "NEEDS_REVIEW",
      "order": 3,
      "owner": null,
      "startDate": null,
      "targetDate": null,
      "completedAt": null,
      "objectives": [
        {
          "id": "OBJ-integration-01",
          "title": "API contract held",
          "required": true,
          "status": "UNKNOWN"
        },
        {
          "id": "OBJ-integration-02",
          "title": "Data path proven",
          "required": true,
          "status": "UNKNOWN"
        },
        {
          "id": "OBJ-integration-03",
          "title": "External dependency has a timeout",
          "required": true,
          "status": "UNKNOWN"
        }
      ],
      "entryCriteria": [
        "Core Functionality completed or waived"
      ],
      "exitCriteria": [
        "Required objectives complete or UNKNOWN-and-accepted",
        "Required checkpoints PASSED or WAIVED"
      ],
      "featureIds": [],
      "requirementIds": [],
      "taskIds": [],
      "riskIds": [],
      "evidence": [],
      "dependencies": [
        "PHASE-002"
      ],
      "releaseId": null
    },
    {
      "id": "PHASE-004",
      "slug": "hardening",
      "name": "Hardening",
      "description": "Security, performance, observability, failure modes.",
      "status": "NEEDS_REVIEW",
      "order": 4,
      "owner": null,
      "startDate": null,
      "targetDate": null,
      "completedAt": null,
      "objectives": [
        {
          "id": "OBJ-hardening-01",
          "title": "Security review of the new surface",
          "required": true,
          "status": "UNKNOWN"
        },
        {
          "id": "OBJ-hardening-02",
          "title": "Failure modes named",
          "required": true,
          "status": "UNKNOWN"
        },
        {
          "id": "OBJ-hardening-03",
          "title": "Performance targets evidenced or marked unknown",
          "required": true,
          "status": "UNKNOWN"
        }
      ],
      "entryCriteria": [
        "Integration completed or waived"
      ],
      "exitCriteria": [
        "Required objectives complete or UNKNOWN-and-accepted",
        "Required checkpoints PASSED or WAIVED"
      ],
      "featureIds": [],
      "requirementIds": [],
      "taskIds": [],
      "riskIds": [],
      "evidence": [],
      "dependencies": [
        "PHASE-003"
      ],
      "releaseId": null
    },
    {
      "id": "PHASE-005",
      "slug": "release-prep",
      "name": "Release Preparation",
      "description": "Evidence, runbooks, flags, cut record.",
      "status": "NEEDS_REVIEW",
      "order": 5,
      "owner": null,
      "startDate": null,
      "targetDate": null,
      "completedAt": null,
      "objectives": [
        {
          "id": "OBJ-release-prep-01",
          "title": "Release record can be cut",
          "required": true,
          "status": "UNKNOWN"
        },
        {
          "id": "OBJ-release-prep-02",
          "title": "Runbook exists",
          "required": true,
          "status": "UNKNOWN"
        },
        {
          "id": "OBJ-release-prep-03",
          "title": "Flags have owners and expiry",
          "required": true,
          "status": "UNKNOWN"
        }
      ],
      "entryCriteria": [
        "Hardening completed or waived"
      ],
      "exitCriteria": [
        "Required objectives complete or UNKNOWN-and-accepted",
        "Required checkpoints PASSED or WAIVED"
      ],
      "featureIds": [],
      "requirementIds": [],
      "taskIds": [],
      "riskIds": [],
      "evidence": [],
      "dependencies": [
        "PHASE-004"
      ],
      "releaseId": null
    },
    {
      "id": "PHASE-006",
      "slug": "launch",
      "name": "Production Launch",
      "description": "Cutover, abort criteria, first live verification.",
      "status": "NEEDS_REVIEW",
      "order": 6,
      "owner": null,
      "startDate": null,
      "targetDate": null,
      "completedAt": null,
      "objectives": [
        {
          "id": "OBJ-launch-01",
          "title": "Abort criteria written",
          "required": true,
          "status": "UNKNOWN"
        },
        {
          "id": "OBJ-launch-02",
          "title": "Rollback named",
          "required": true,
          "status": "UNKNOWN"
        },
        {
          "id": "OBJ-launch-03",
          "title": "First live check listed",
          "required": true,
          "status": "UNKNOWN"
        }
      ],
      "entryCriteria": [
        "Release Preparation completed or waived"
      ],
      "exitCriteria": [
        "Required objectives complete or UNKNOWN-and-accepted",
        "Required checkpoints PASSED or WAIVED"
      ],
      "featureIds": [],
      "requirementIds": [],
      "taskIds": [],
      "riskIds": [],
      "evidence": [],
      "dependencies": [
        "PHASE-005"
      ],
      "releaseId": null
    },
    {
      "id": "PHASE-007",
      "slug": "post-release",
      "name": "Post-Release Improvement",
      "description": "What production taught, and the next increment.",
      "status": "IN_PROGRESS",
      "order": 7,
      "owner": null,
      "startDate": null,
      "targetDate": null,
      "completedAt": null,
      "objectives": [
        {
          "id": "OBJ-post-release-01",
          "title": "Incidents have guards",
          "required": true,
          "status": "UNKNOWN"
        },
        {
          "id": "OBJ-post-release-02",
          "title": "Next increment chosen",
          "required": true,
          "status": "UNKNOWN"
        },
        {
          "id": "OBJ-post-release-03",
          "title": "Stale traces refreshed",
          "required": true,
          "status": "UNKNOWN"
        }
      ],
      "entryCriteria": [
        "Production Launch completed or waived"
      ],
      "exitCriteria": [
        "Required objectives complete or UNKNOWN-and-accepted",
        "Required checkpoints PASSED or WAIVED"
      ],
      "featureIds": [],
      "requirementIds": [],
      "taskIds": [],
      "riskIds": [],
      "evidence": [],